name,matches,total_runs,total_wickets,bowled_wickets,caught_wickets,lbw_wickets
"Rajiv Gandhi International Stadium, UppalRajiv Gandhi International Stadium, UppalRajiv Gandhi International Stadium, UppalRajiv Gandhi International Stadium, UppalRajiv Gandhi International Stadium, UppalRajiv Gandhi International Stadium, UppalRajiv Gandhi International Stadium, UppalRajiv Gandhi International Stadium, UppalRajiv Gandhi International Stadium, UppalRajiv Gandhi International Stadium, UppalRajiv Gandhi International Stadium, UppalRajiv Gandhi International Stadium, UppalRajiv Gandhi International Stadium, UppalRajiv Gandhi International Stadium, UppalRajiv Gandhi International Stadium, UppalRajiv Gandhi International Stadium, UppalRajiv Gandhi International Stadium, UppalRajiv Gandhi International Stadium, UppalRajiv Gandhi International Stadium, UppalRajiv Gandhi International Stadium, UppalRajiv Gandhi International Stadium, UppalRajiv Gandhi International Stadium, UppalRajiv Gandhi International Stadium, UppalRajiv Gandhi International Stadium, UppalRajiv Gandhi International Stadium, UppalRajiv Gandhi International Stadium, UppalRajiv Gandhi International Stadium, UppalRajiv Gandhi International Stadium, UppalRajiv Gandhi International Stadium, UppalRajiv Gandhi International Stadium, UppalRajiv Gandhi International Stadium, UppalRajiv Gandhi International Stadium, UppalRajiv Gandhi International Stadium, UppalRajiv Gandhi International Stadium, UppalRajiv Gandhi International Stadium, UppalRajiv Gandhi International Stadium, UppalRajiv Gandhi International Stadium, UppalRajiv Gandhi International Stadium, UppalRajiv Gandhi International Stadium, UppalRajiv Gandhi International Stadium, UppalRajiv Gandhi International Stadium, UppalRajiv Gandhi International Stadium, UppalRajiv Gandhi International Stadium, UppalRajiv Gandhi International Stadium, UppalRajiv Gandhi International Stadium, UppalRajiv Gandhi International Stadium, UppalRajiv Gandhi International Stadium, UppalRajiv Gandhi International Stadium, UppalRajiv Gandhi International Stadium, Uppal",49,14179,576,96,349,35
Maharashtra Cricket Association StadiumMaharashtra Cricket Association StadiumMaharashtra Cricket Association StadiumMaharashtra Cricket Association StadiumMaharashtra Cricket Association StadiumMaharashtra Cricket Association StadiumMaharashtra Cricket Association StadiumMaharashtra Cricket Association StadiumMaharashtra Cricket Association StadiumMaharashtra Cricket Association StadiumMaharashtra Cricket Association StadiumMaharashtra Cricket Association StadiumMaharashtra Cricket Association StadiumMaharashtra Cricket Association StadiumMaharashtra Cricket Association StadiumMaharashtra Cricket Association StadiumMaharashtra Cricket Association StadiumMaharashtra Cricket Association StadiumMaharashtra Cricket Association StadiumMaharashtra Cricket Association StadiumMaharashtra Cricket Association StadiumMaharashtra Cricket Association Stadium,22,6687,259,43,165,14
Saurashtra Cricket Association StadiumSaurashtra Cricket Association StadiumSaurashtra Cricket Association StadiumSaurashtra Cricket Association StadiumSaurashtra Cricket Association StadiumSaurashtra Cricket Association StadiumSaurashtra Cricket Association StadiumSaurashtra Cricket Association StadiumSaurashtra Cricket Association StadiumSaurashtra Cricket Association Stadium,10,3198,116,21,62,9
Holkar Cricket StadiumHolkar Cricket StadiumHolkar Cricket StadiumHolkar Cricket StadiumHolkar Cricket StadiumHolkar Cricket StadiumHolkar Cricket StadiumHolkar Cricket StadiumHolkar Cricket Stadium,9,2735,87,18,56,8
M.Chinnaswamy StadiumM.Chinnaswamy StadiumM.Chinnaswamy StadiumM.Chinnaswamy StadiumM.Chinnaswamy StadiumM.Chinnaswamy StadiumM.Chinnaswamy StadiumM.Chinnaswamy StadiumM.Chinnaswamy StadiumM.Chinnaswamy StadiumM.Chinnaswamy StadiumM.Chinnaswamy StadiumM.Chinnaswamy StadiumM.Chinnaswamy StadiumM.Chinnaswamy Stadium,15,4896,172,27,125,8
Wankhede StadiumWankhede StadiumWankhede StadiumWankhede StadiumWankhede StadiumWankhede StadiumWankhede StadiumWankhede StadiumWankhede StadiumWankhede StadiumWankhede StadiumWankhede StadiumWankhede StadiumWankhede StadiumWankhede StadiumWankhede StadiumWankhede StadiumWankhede StadiumWankhede StadiumWankhede StadiumWankhede StadiumWankhede StadiumWankhede StadiumWankhede StadiumWankhede StadiumWankhede StadiumWankhede StadiumWankhede StadiumWankhede StadiumWankhede StadiumWankhede StadiumWankhede StadiumWankhede StadiumWankhede StadiumWankhede StadiumWankhede StadiumWankhede StadiumWankhede StadiumWankhede StadiumWankhede StadiumWankhede StadiumWankhede StadiumWankhede StadiumWankhede StadiumWankhede StadiumWankhede StadiumWankhede StadiumWankhede StadiumWankhede StadiumWankhede StadiumWankhede StadiumWankhede StadiumWankhede StadiumWankhede StadiumWankhede StadiumWankhede StadiumWankhede StadiumWankhede StadiumWankhede StadiumWankhede StadiumWankhede StadiumWankhede StadiumWankhede StadiumWankhede StadiumWankhede StadiumWankhede StadiumWankhede StadiumWankhede StadiumWankhede StadiumWankhede StadiumWankhede StadiumWankhede StadiumWankhede Stadium,73,22175,907,136,590,56
Eden GardensEden GardensEden GardensEden GardensEden GardensEden GardensEden GardensEden GardensEden GardensEden GardensEden GardensEden GardensEden GardensEden GardensEden GardensEden GardensEden GardensEden GardensEden GardensEden GardensEden GardensEden GardensEden GardensEden GardensEden GardensEden GardensEden GardensEden GardensEden GardensEden GardensEden GardensEden GardensEden GardensEden GardensEden GardensEden GardensEden GardensEden GardensEden GardensEden GardensEden GardensEden GardensEden GardensEden GardensEden GardensEden GardensEden GardensEden GardensEden GardensEden GardensEden GardensEden GardensEden GardensEden GardensEden GardensEden GardensEden GardensEden GardensEden GardensEden GardensEden GardensEden GardensEden GardensEden GardensEden GardensEden GardensEden GardensEden GardensEden GardensEden GardensEden GardensEden GardensEden GardensEden GardensEden GardensEden GardensEden Gardens,77,22443,893,173,508,65
M Chinnaswamy StadiumM Chinnaswamy StadiumM Chinnaswamy StadiumM Chinnaswamy StadiumM Chinnaswamy StadiumM Chinnaswamy StadiumM Chinnaswamy StadiumM Chinnaswamy StadiumM Chinnaswamy StadiumM Chinnaswamy StadiumM Chinnaswamy StadiumM Chinnaswamy StadiumM Chinnaswamy StadiumM Chinnaswamy StadiumM Chinnaswamy StadiumM Chinnaswamy StadiumM Chinnaswamy StadiumM Chinnaswamy StadiumM Chinnaswamy StadiumM Chinnaswamy StadiumM Chinnaswamy StadiumM Chinnaswamy StadiumM Chinnaswamy StadiumM Chinnaswamy StadiumM Chinnaswamy StadiumM Chinnaswamy StadiumM Chinnaswamy StadiumM Chinnaswamy StadiumM Chinnaswamy StadiumM Chinnaswamy StadiumM Chinnaswamy StadiumM Chinnaswamy StadiumM Chinnaswamy StadiumM Chinnaswamy StadiumM Chinnaswamy StadiumM Chinnaswamy StadiumM Chinnaswamy StadiumM Chinnaswamy StadiumM Chinnaswamy StadiumM Chinnaswamy StadiumM Chinnaswamy StadiumM Chinnaswamy StadiumM Chinnaswamy StadiumM Chinnaswamy StadiumM Chinnaswamy StadiumM Chinnaswamy StadiumM Chinnaswamy StadiumM Chinnaswamy StadiumM Chinnaswamy StadiumM Chinnaswamy StadiumM Chinnaswamy StadiumM Chinnaswamy StadiumM Chinnaswamy StadiumM Chinnaswamy StadiumM Chinnaswamy StadiumM Chinnaswamy StadiumM Chinnaswamy StadiumM Chinnaswamy StadiumM Chinnaswamy StadiumM Chinnaswamy StadiumM Chinnaswamy StadiumM Chinnaswamy StadiumM Chinnaswamy StadiumM Chinnaswamy StadiumM Chinnaswamy Stadium,65,19139,759,154,453,39
Feroz Shah KotlaFeroz Shah KotlaFeroz Shah KotlaFeroz Shah KotlaFeroz Shah KotlaFeroz Shah KotlaFeroz Shah KotlaFeroz Shah KotlaFeroz Shah KotlaFeroz Shah KotlaFeroz Shah KotlaFeroz Shah KotlaFeroz Shah KotlaFeroz Shah KotlaFeroz Shah KotlaFeroz Shah KotlaFeroz Shah KotlaFeroz Shah KotlaFeroz Shah KotlaFeroz Shah KotlaFeroz Shah KotlaFeroz Shah KotlaFeroz Shah KotlaFeroz Shah KotlaFeroz Shah KotlaFeroz Shah KotlaFeroz Shah KotlaFeroz Shah KotlaFeroz Shah KotlaFeroz Shah KotlaFeroz Shah KotlaFeroz Shah KotlaFeroz Shah KotlaFeroz Shah KotlaFeroz Shah KotlaFeroz Shah KotlaFeroz Shah KotlaFeroz Shah KotlaFeroz Shah KotlaFeroz Shah KotlaFeroz Shah KotlaFeroz Shah KotlaFeroz Shah KotlaFeroz Shah KotlaFeroz Shah KotlaFeroz Shah KotlaFeroz Shah KotlaFeroz Shah KotlaFeroz Shah KotlaFeroz Shah KotlaFeroz Shah KotlaFeroz Shah KotlaFeroz Shah KotlaFeroz Shah KotlaFeroz Shah KotlaFeroz Shah KotlaFeroz Shah KotlaFeroz Shah KotlaFeroz Shah KotlaFeroz Shah Kotla,60,17499,720,130,410,41
"Punjab Cricket Association IS Bindra Stadium, MohaliPunjab Cricket Association IS Bindra Stadium, MohaliPunjab Cricket Association IS Bindra Stadium, MohaliPunjab Cricket Association IS Bindra Stadium, MohaliPunjab Cricket Association IS Bindra Stadium, MohaliPunjab Cricket Association IS Bindra Stadium, MohaliPunjab Cricket Association IS Bindra Stadium, MohaliPunjab Cricket Association IS Bindra Stadium, MohaliPunjab Cricket Association IS Bindra Stadium, MohaliPunjab Cricket Association IS Bindra Stadium, MohaliPunjab Cricket Association IS Bindra Stadium, Mohali",11,3416,119,23,73,5
Green ParkGreen ParkGreen ParkGreen Park,4,1236,49,13,27,3
Punjab Cricket Association IS Bindra StadiumPunjab Cricket Association IS Bindra StadiumPunjab Cricket Association IS Bindra StadiumPunjab Cricket Association IS Bindra StadiumPunjab Cricket Association IS Bindra StadiumPunjab Cricket Association IS Bindra StadiumPunjab Cricket Association IS Bindra StadiumPunjab Cricket Association IS Bindra StadiumPunjab Cricket Association IS Bindra StadiumPunjab Cricket Association IS Bindra Stadium,10,3334,97,16,63,12
Rajiv Gandhi International StadiumRajiv Gandhi International StadiumRajiv Gandhi International StadiumRajiv Gandhi International StadiumRajiv Gandhi International StadiumRajiv Gandhi International StadiumRajiv Gandhi International StadiumRajiv Gandhi International StadiumRajiv Gandhi International StadiumRajiv Gandhi International StadiumRajiv Gandhi International StadiumRajiv Gandhi International StadiumRajiv Gandhi International StadiumRajiv Gandhi International StadiumRajiv Gandhi International Stadium,15,4439,175,30,120,17
MA Chidambaram StadiumMA Chidambaram StadiumMA Chidambaram StadiumMA Chidambaram StadiumMA Chidambaram StadiumMA Chidambaram StadiumMA Chidambaram StadiumMA Chidambaram StadiumMA Chidambaram Stadium,9,2463,102,11,70,4
Sawai Mansingh StadiumSawai Mansingh StadiumSawai Mansingh StadiumSawai Mansingh StadiumSawai Mansingh StadiumSawai Mansingh StadiumSawai Mansingh StadiumSawai Mansingh StadiumSawai Mansingh StadiumSawai Mansingh StadiumSawai Mansingh StadiumSawai Mansingh StadiumSawai Mansingh StadiumSawai Mansingh StadiumSawai Mansingh StadiumSawai Mansingh StadiumSawai Mansingh StadiumSawai Mansingh StadiumSawai Mansingh StadiumSawai Mansingh StadiumSawai Mansingh StadiumSawai Mansingh StadiumSawai Mansingh StadiumSawai Mansingh StadiumSawai Mansingh StadiumSawai Mansingh StadiumSawai Mansingh StadiumSawai Mansingh StadiumSawai Mansingh StadiumSawai Mansingh StadiumSawai Mansingh StadiumSawai Mansingh StadiumSawai Mansingh StadiumSawai Mansingh StadiumSawai Mansingh StadiumSawai Mansingh StadiumSawai Mansingh StadiumSawai Mansingh StadiumSawai Mansingh StadiumSawai Mansingh StadiumSawai Mansingh StadiumSawai Mansingh StadiumSawai Mansingh StadiumSawai Mansingh StadiumSawai Mansingh StadiumSawai Mansingh StadiumSawai Mansingh Stadium,47,13473,520,100,311,26
Arun Jaitley StadiumArun Jaitley StadiumArun Jaitley StadiumArun Jaitley StadiumArun Jaitley StadiumArun Jaitley StadiumArun Jaitley StadiumArun Jaitley StadiumArun Jaitley StadiumArun Jaitley StadiumArun Jaitley StadiumArun Jaitley StadiumArun Jaitley StadiumArun Jaitley Stadium,14,4351,162,29,109,9
Dr. Y.S. Rajasekhara Reddy ACA-VDCA Cricket StadiumDr. Y.S. Rajasekhara Reddy ACA-VDCA Cricket StadiumDr. Y.S. Rajasekhara Reddy ACA-VDCA Cricket StadiumDr. Y.S. Rajasekhara Reddy ACA-VDCA Cricket StadiumDr. Y.S. Rajasekhara Reddy ACA-VDCA Cricket StadiumDr. Y.S. Rajasekhara Reddy ACA-VDCA Cricket StadiumDr. Y.S. Rajasekhara Reddy ACA-VDCA Cricket StadiumDr. Y.S. Rajasekhara Reddy ACA-VDCA Cricket StadiumDr. Y.S. Rajasekhara Reddy ACA-VDCA Cricket StadiumDr. Y.S. Rajasekhara Reddy ACA-VDCA Cricket StadiumDr. Y.S. Rajasekhara Reddy ACA-VDCA Cricket StadiumDr. Y.S. Rajasekhara Reddy ACA-VDCA Cricket StadiumDr. Y.S. Rajasekhara Reddy ACA-VDCA Cricket Stadium,13,3585,166,32,104,11
Sheikh Zayed StadiumSheikh Zayed StadiumSheikh Zayed StadiumSheikh Zayed StadiumSheikh Zayed StadiumSheikh Zayed StadiumSheikh Zayed StadiumSheikh Zayed StadiumSheikh Zayed StadiumSheikh Zayed StadiumSheikh Zayed StadiumSheikh Zayed StadiumSheikh Zayed StadiumSheikh Zayed StadiumSheikh Zayed StadiumSheikh Zayed StadiumSheikh Zayed StadiumSheikh Zayed StadiumSheikh Zayed StadiumSheikh Zayed StadiumSheikh Zayed StadiumSheikh Zayed StadiumSheikh Zayed StadiumSheikh Zayed StadiumSheikh Zayed StadiumSheikh Zayed StadiumSheikh Zayed StadiumSheikh Zayed StadiumSheikh Zayed Stadium,29,8467,321,61,210,24
Dubai International Cricket StadiumDubai International Cricket StadiumDubai International Cricket StadiumDubai International Cricket StadiumDubai International Cricket StadiumDubai International Cricket StadiumDubai International Cricket StadiumDubai International Cricket StadiumDubai International Cricket StadiumDubai International Cricket StadiumDubai International Cricket StadiumDubai International Cricket StadiumDubai International Cricket StadiumDubai International Cricket StadiumDubai International Cricket StadiumDubai International Cricket StadiumDubai International Cricket StadiumDubai International Cricket StadiumDubai International Cricket StadiumDubai International Cricket StadiumDubai International Cricket StadiumDubai International Cricket StadiumDubai International Cricket StadiumDubai International Cricket StadiumDubai International Cricket StadiumDubai International Cricket StadiumDubai International Cricket StadiumDubai International Cricket StadiumDubai International Cricket StadiumDubai International Cricket StadiumDubai International Cricket StadiumDubai International Cricket StadiumDubai International Cricket StadiumDubai International Cricket StadiumDubai International Cricket StadiumDubai International Cricket StadiumDubai International Cricket StadiumDubai International Cricket StadiumDubai International Cricket StadiumDubai International Cricket StadiumDubai International Cricket StadiumDubai International Cricket StadiumDubai International Cricket StadiumDubai International Cricket StadiumDubai International Cricket StadiumDubai International Cricket Stadium,46,13753,525,89,362,28
Sharjah Cricket StadiumSharjah Cricket StadiumSharjah Cricket StadiumSharjah Cricket StadiumSharjah Cricket StadiumSharjah Cricket StadiumSharjah Cricket StadiumSharjah Cricket StadiumSharjah Cricket StadiumSharjah Cricket StadiumSharjah Cricket StadiumSharjah Cricket StadiumSharjah Cricket StadiumSharjah Cricket StadiumSharjah Cricket StadiumSharjah Cricket StadiumSharjah Cricket StadiumSharjah Cricket StadiumSharjah Cricket StadiumSharjah Cricket StadiumSharjah Cricket StadiumSharjah Cricket StadiumSharjah Cricket StadiumSharjah Cricket StadiumSharjah Cricket StadiumSharjah Cricket StadiumSharjah Cricket StadiumSharjah Cricket Stadium,28,8159,320,73,199,21
"MA Chidambaram Stadium, Chepauk, ChennaiMA Chidambaram Stadium, Chepauk, ChennaiMA Chidambaram Stadium, Chepauk, ChennaiMA Chidambaram Stadium, Chepauk, ChennaiMA Chidambaram Stadium, Chepauk, ChennaiMA Chidambaram Stadium, Chepauk, ChennaiMA Chidambaram Stadium, Chepauk, ChennaiMA Chidambaram Stadium, Chepauk, ChennaiMA Chidambaram Stadium, Chepauk, ChennaiMA Chidambaram Stadium, Chepauk, ChennaiMA Chidambaram Stadium, Chepauk, ChennaiMA Chidambaram Stadium, Chepauk, ChennaiMA Chidambaram Stadium, Chepauk, ChennaiMA Chidambaram Stadium, Chepauk, ChennaiMA Chidambaram Stadium, Chepauk, ChennaiMA Chidambaram Stadium, Chepauk, ChennaiMA Chidambaram Stadium, Chepauk, ChennaiMA Chidambaram Stadium, Chepauk, ChennaiMA Chidambaram Stadium, Chepauk, ChennaiMA Chidambaram Stadium, Chepauk, ChennaiMA Chidambaram Stadium, Chepauk, ChennaiMA Chidambaram Stadium, Chepauk, ChennaiMA Chidambaram Stadium, Chepauk, ChennaiMA Chidambaram Stadium, Chepauk, ChennaiMA Chidambaram Stadium, Chepauk, ChennaiMA Chidambaram Stadium, Chepauk, ChennaiMA Chidambaram Stadium, Chepauk, ChennaiMA Chidambaram Stadium, Chepauk, Chennai",28,8360,354,49,242,24
"Wankhede Stadium, MumbaiWankhede Stadium, MumbaiWankhede Stadium, MumbaiWankhede Stadium, MumbaiWankhede Stadium, MumbaiWankhede Stadium, MumbaiWankhede Stadium, MumbaiWankhede Stadium, MumbaiWankhede Stadium, MumbaiWankhede Stadium, MumbaiWankhede Stadium, MumbaiWankhede Stadium, MumbaiWankhede Stadium, MumbaiWankhede Stadium, MumbaiWankhede Stadium, MumbaiWankhede Stadium, MumbaiWankhede Stadium, MumbaiWankhede Stadium, MumbaiWankhede Stadium, MumbaiWankhede Stadium, MumbaiWankhede Stadium, MumbaiWankhede Stadium, MumbaiWankhede Stadium, MumbaiWankhede Stadium, MumbaiWankhede Stadium, MumbaiWankhede Stadium, MumbaiWankhede Stadium, MumbaiWankhede Stadium, MumbaiWankhede Stadium, MumbaiWankhede Stadium, MumbaiWankhede Stadium, MumbaiWankhede Stadium, MumbaiWankhede Stadium, MumbaiWankhede Stadium, MumbaiWankhede Stadium, MumbaiWankhede Stadium, MumbaiWankhede Stadium, MumbaiWankhede Stadium, MumbaiWankhede Stadium, MumbaiWankhede Stadium, MumbaiWankhede Stadium, MumbaiWankhede Stadium, MumbaiWankhede Stadium, MumbaiWankhede Stadium, MumbaiWankhede Stadium, Mumbai",45,14744,522,87,347,41
"Narendra Modi Stadium, AhmedabadNarendra Modi Stadium, AhmedabadNarendra Modi Stadium, AhmedabadNarendra Modi Stadium, AhmedabadNarendra Modi Stadium, AhmedabadNarendra Modi Stadium, AhmedabadNarendra Modi Stadium, AhmedabadNarendra Modi Stadium, AhmedabadNarendra Modi Stadium, AhmedabadNarendra Modi Stadium, AhmedabadNarendra Modi Stadium, AhmedabadNarendra Modi Stadium, AhmedabadNarendra Modi Stadium, AhmedabadNarendra Modi Stadium, AhmedabadNarendra Modi Stadium, AhmedabadNarendra Modi Stadium, AhmedabadNarendra Modi Stadium, AhmedabadNarendra Modi Stadium, AhmedabadNarendra Modi Stadium, AhmedabadNarendra Modi Stadium, AhmedabadNarendra Modi Stadium, AhmedabadNarendra Modi Stadium, AhmedabadNarendra Modi Stadium, AhmedabadNarendra Modi Stadium, Ahmedabad",24,7750,286,44,198,11
"Arun Jaitley Stadium, DelhiArun Jaitley Stadium, DelhiArun Jaitley Stadium, DelhiArun Jaitley Stadium, DelhiArun Jaitley Stadium, DelhiArun Jaitley Stadium, DelhiArun Jaitley Stadium, DelhiArun Jaitley Stadium, DelhiArun Jaitley Stadium, DelhiArun Jaitley Stadium, DelhiArun Jaitley Stadium, DelhiArun Jaitley Stadium, DelhiArun Jaitley Stadium, DelhiArun Jaitley Stadium, DelhiArun Jaitley Stadium, DelhiArun Jaitley Stadium, Delhi",16,5808,196,34,128,16
"Zayed Cricket Stadium, Abu DhabiZayed Cricket Stadium, Abu DhabiZayed Cricket Stadium, Abu DhabiZayed Cricket Stadium, Abu DhabiZayed Cricket Stadium, Abu DhabiZayed Cricket Stadium, Abu DhabiZayed Cricket Stadium, Abu DhabiZayed Cricket Stadium, Abu Dhabi",8,2372,97,16,60,7
"Brabourne Stadium, MumbaiBrabourne Stadium, MumbaiBrabourne Stadium, MumbaiBrabourne Stadium, MumbaiBrabourne Stadium, MumbaiBrabourne Stadium, MumbaiBrabourne Stadium, MumbaiBrabourne Stadium, MumbaiBrabourne Stadium, MumbaiBrabourne Stadium, MumbaiBrabourne Stadium, MumbaiBrabourne Stadium, MumbaiBrabourne Stadium, MumbaiBrabourne Stadium, MumbaiBrabourne Stadium, MumbaiBrabourne Stadium, MumbaiBrabourne Stadium, Mumbai",17,5497,216,36,139,14
"Dr DY Patil Sports Academy, MumbaiDr DY Patil Sports Academy, MumbaiDr DY Patil Sports Academy, MumbaiDr DY Patil Sports Academy, MumbaiDr DY Patil Sports Academy, MumbaiDr DY Patil Sports Academy, MumbaiDr DY Patil Sports Academy, MumbaiDr DY Patil Sports Academy, MumbaiDr DY Patil Sports Academy, MumbaiDr DY Patil Sports Academy, MumbaiDr DY Patil Sports Academy, MumbaiDr DY Patil Sports Academy, MumbaiDr DY Patil Sports Academy, MumbaiDr DY Patil Sports Academy, MumbaiDr DY Patil Sports Academy, MumbaiDr DY Patil Sports Academy, MumbaiDr DY Patil Sports Academy, MumbaiDr DY Patil Sports Academy, MumbaiDr DY Patil Sports Academy, MumbaiDr DY Patil Sports Academy, Mumbai",20,6199,257,27,195,12
"Maharashtra Cricket Association Stadium, PuneMaharashtra Cricket Association Stadium, PuneMaharashtra Cricket Association Stadium, PuneMaharashtra Cricket Association Stadium, PuneMaharashtra Cricket Association Stadium, PuneMaharashtra Cricket Association Stadium, PuneMaharashtra Cricket Association Stadium, PuneMaharashtra Cricket Association Stadium, PuneMaharashtra Cricket Association Stadium, PuneMaharashtra Cricket Association Stadium, PuneMaharashtra Cricket Association Stadium, PuneMaharashtra Cricket Association Stadium, PuneMaharashtra Cricket Association Stadium, Pune",13,3913,178,19,124,12
"Eden Gardens, KolkataEden Gardens, KolkataEden Gardens, KolkataEden Gardens, KolkataEden Gardens, KolkataEden Gardens, KolkataEden Gardens, KolkataEden Gardens, KolkataEden Gardens, KolkataEden Gardens, KolkataEden Gardens, KolkataEden Gardens, KolkataEden Gardens, KolkataEden Gardens, KolkataEden Gardens, KolkataEden Gardens, Kolkata",16,5739,193,24,144,11
"Punjab Cricket Association IS Bindra Stadium, Mohali, ChandigarhPunjab Cricket Association IS Bindra Stadium, Mohali, ChandigarhPunjab Cricket Association IS Bindra Stadium, Mohali, ChandigarhPunjab Cricket Association IS Bindra Stadium, Mohali, ChandigarhPunjab Cricket Association IS Bindra Stadium, Mohali, Chandigarh",5,1758,62,10,39,4
"Bharat Ratna Shri Atal Bihari Vajpayee Ekana Cricket Stadium, LucknowBharat Ratna Shri Atal Bihari Vajpayee Ekana Cricket Stadium, LucknowBharat Ratna Shri Atal Bihari Vajpayee Ekana Cricket Stadium, LucknowBharat Ratna Shri Atal Bihari Vajpayee Ekana Cricket Stadium, LucknowBharat Ratna Shri Atal Bihari Vajpayee Ekana Cricket Stadium, LucknowBharat Ratna Shri Atal Bihari Vajpayee Ekana Cricket Stadium, LucknowBharat Ratna Shri Atal Bihari Vajpayee Ekana Cricket Stadium, LucknowBharat Ratna Shri Atal Bihari Vajpayee Ekana Cricket Stadium, LucknowBharat Ratna Shri Atal Bihari Vajpayee Ekana Cricket Stadium, LucknowBharat Ratna Shri Atal Bihari Vajpayee Ekana Cricket Stadium, LucknowBharat Ratna Shri Atal Bihari Vajpayee Ekana Cricket Stadium, LucknowBharat Ratna Shri Atal Bihari Vajpayee Ekana Cricket Stadium, LucknowBharat Ratna Shri Atal Bihari Vajpayee Ekana Cricket Stadium, LucknowBharat Ratna Shri Atal Bihari Vajpayee Ekana Cricket Stadium, Lucknow",14,4069,179,23,117,12
"Rajiv Gandhi International Stadium, Uppal, HyderabadRajiv Gandhi International Stadium, Uppal, HyderabadRajiv Gandhi International Stadium, Uppal, HyderabadRajiv Gandhi International Stadium, Uppal, HyderabadRajiv Gandhi International Stadium, Uppal, HyderabadRajiv Gandhi International Stadium, Uppal, HyderabadRajiv Gandhi International Stadium, Uppal, HyderabadRajiv Gandhi International Stadium, Uppal, HyderabadRajiv Gandhi International Stadium, Uppal, HyderabadRajiv Gandhi International Stadium, Uppal, HyderabadRajiv Gandhi International Stadium, Uppal, HyderabadRajiv Gandhi International Stadium, Uppal, HyderabadRajiv Gandhi International Stadium, Uppal, Hyderabad",13,4540,146,21,102,10
"M Chinnaswamy Stadium, BengaluruM Chinnaswamy Stadium, BengaluruM Chinnaswamy Stadium, BengaluruM Chinnaswamy Stadium, BengaluruM Chinnaswamy Stadium, BengaluruM Chinnaswamy Stadium, BengaluruM Chinnaswamy Stadium, BengaluruM Chinnaswamy Stadium, BengaluruM Chinnaswamy Stadium, BengaluruM Chinnaswamy Stadium, BengaluruM Chinnaswamy Stadium, BengaluruM Chinnaswamy Stadium, BengaluruM Chinnaswamy Stadium, BengaluruM Chinnaswamy Stadium, Bengaluru",14,5040,179,21,128,7
"Barsapara Cricket Stadium, GuwahatiBarsapara Cricket Stadium, GuwahatiBarsapara Cricket Stadium, Guwahati",3,980,39,6,23,4
"Sawai Mansingh Stadium, JaipurSawai Mansingh Stadium, JaipurSawai Mansingh Stadium, JaipurSawai Mansingh Stadium, JaipurSawai Mansingh Stadium, JaipurSawai Mansingh Stadium, JaipurSawai Mansingh Stadium, JaipurSawai Mansingh Stadium, JaipurSawai Mansingh Stadium, JaipurSawai Mansingh Stadium, Jaipur",10,3273,107,17,67,11
"Himachal Pradesh Cricket Association Stadium, DharamsalaHimachal Pradesh Cricket Association Stadium, DharamsalaHimachal Pradesh Cricket Association Stadium, DharamsalaHimachal Pradesh Cricket Association Stadium, Dharamsala",4,1456,55,10,33,5
"Maharaja Yadavindra Singh International Cricket Stadium, MullanpurMaharaja Yadavindra Singh International Cricket Stadium, MullanpurMaharaja Yadavindra Singh International Cricket Stadium, MullanpurMaharaja Yadavindra Singh International Cricket Stadium, MullanpurMaharaja Yadavindra Singh International Cricket Stadium, Mullanpur",5,1593,80,10,56,4
"Dr. Y.S. Rajasekhara Reddy ACA-VDCA Cricket Stadium, VisakhapatnamDr. Y.S. Rajasekhara Reddy ACA-VDCA Cricket Stadium, Visakhapatnam",2,738,28,4,22,0
